{
  "schema":"spectral-kernel-benchmark-v1",
  "status":"passed",
  "numericType":{"id":"float64","scalarBits":64},
  "run":{"id":"20260828T194650Z-issue17-ref-n256-fftwpp-parallel","profile":"wvm-current-256-nz129-f4","seed":129,"warmups":3,"samples":21},
  "provenance":{"benchmarkRepository":"JeffreyEarly/spectral-kernel-benchmarks","waveVortexModelRepository":"JeffreyEarly/wave-vortex-model","waveVortexModelIssue":129,"auditedProductionBaselineCommit":"be0f78995c49a2bfe4c43d75827856e3812ac278","historicalHarnessCommit":"b63fef8f6a9e400c6ec560205906578b763d8298","historicalDecisionCommit":"34797085d1b642b9d9c822f30a6b5c18e139c2bf"},
  "logicalOperators":{"horizontalForward":"T_h^+=P_h F_xy","horizontalInverse":"T_h^-=F_xy^-1 E_h","verticalForward":"T_z^+=V_f","verticalInverse":"T_z^-=V_i","verticalFixtureId":"orthonormal-dct2-truncated-v1","resultKey":"(k,l,j,field)"},
  "workload":{
    "Nx":256,"Ny":256,"Nz":1,"fields":4,
    "H":33024,"Nkl":11436,"Nj":0,"planes":4,
    "antialias":{"enabled":true,"horizontalPolicy":"radial-two-thirds","horizontalCutoffFraction":0.66666666666666663,"verticalPolicy":"floor(2*(Nz-1)/3)","verticalRetainedFraction":0},
    "grouping":{"realPlaneOrder":"x-fastest,y,z,field","fullSpectrumOrder":"z-fastest,field,kx,ky","retainedOrder":"z-fastest,field,radial-mode","verticalColumnOrder":"field-fastest-within-radial-mode","verticalMatrixFamilyId":"orthonormal-dct2-truncated-v1","verticalGroupCount":0,"verticalGroupModes":{"minimum":0,"median":0,"maximum":0},"verticalGroupColumns":{"minimum":0,"median":0,"maximum":0},"verticalGroupOrderHash":""},
    "stridesElements":{"real":{"x":1,"y":256,"z":65536,"field":65536},"fullSpectrum":{"z":1,"field":1,"kx":4,"ky":516},"retainedSpectrum":{"z":1,"field":1,"mode":4},"modalSpectrum":{"j":1,"field":0,"mode":0}},
    "bytes":{"real":7864320,"fullSpectrum":7925760,"retainedSpectrum":2744640,"modalSpectrum":0,"verticalMatrixFamilySource":0,"verticalBenchmarkEstimatedExplicitPeak":0,"orderingPackingEstimatedExplicitPeak":0,"spectralPipelineEstimatedExplicitPeak":0},
    "permutationHashes":{"retainedModeOrder":"centered-k-then-nonnegative-l-radial-disk-v1","wvmFullSpectrumOrder":""}
  },
  "environment":{"timestampUtc":"2026-08-28T19:46:50Z","hostname":"lyra","operatingSystem":"Darwin 25.6.0 arm64","machineModel":"Mac16,9","cpuBrand":"Apple M4 Max","totalCores":16,"performanceCores":12,"efficiencyCores":4,"physicalMemoryBytes":137438953472,"compiler":"AppleClang","compilerVersion":"21.0.0 (clang-2100.1.1.101)","compilerFlags":"-O3 -mcpu=native","buildType":"Release","gitCommit":"22781068236a","gitDirty":false},
  "providers":[
    {"id":"fftwpp-parallel-target-wvm-advection","version":"3.04","libraryIdentity":"FFTW++ public master pinned at e685733aba768d77e9234ca02092632f7ccb4c86","algorithmId":"hybrid-centered-hermitian-parallel-target-wvm-advection-6to1x4","nativeRepresentationId":"centered-rectangular-hermitian","modeOrderId":"centered-k-then-nonnegative-l-radial-disk-v1","schedulingId":"persistent-outer-static-4-target-applications","providerBuild":{"sourceIdentity":"https://github.com/dealias/fftwpp/commit/e685733aba768d77e9234ca02092632f7ccb4c86","sourceSha256":"","configureFlags":"FFTWPP_SINGLE_THREAD=1; x{m=128,p=2,q=2,n=2,D=1,loops=2,loop2=true}; y{m=256,p=1,q=1,n=1,D=1,loops=1,loop2=false}","compilerFlags":""},"workers":4,"scheduling":{"internalWorkers":1,"outerWorkers":4,"totalLogicalWorkers":4},"gemmCallsPerExecution":0,"executionContract":{"forward":{"nativePlacement":"out-of-place","adapterPlacement":"out-of-place","destroysNativeInput":true,"adapterPreservesCallerInput":true,"requiresPreservationCopyForRepeatedExecution":true,"preservationIncludedInPrimitiveTiming":false,"preservationIncludedInAdapterTiming":true,"nativeInputRepresentationId":"centered-rectangular-hermitian","nativeOutputRepresentationId":"centered-rectangular-hermitian","adapterInputRepresentationId":"mode-keyed-radial-hermitian-wvm-advection-inputs-15","adapterOutputRepresentationId":"mode-keyed-radial-hermitian-wvm-flux-targets-4","physicalExtents":"Nx=Ny=256; advectors=3; derivative-fields=12; flux-targets=4; topology=four-independent-6-input-1-output-applications","stridesElements":"","paddingElements":0,"minimumAlignmentBytes":0,"aliasing":"native execution overwrites provider buffers; the timed complete adapter copies from and preserves the caller-owned compact input","reusableWorkBytes":0,"outputCanFeedOppositeDirection":false},"inverse":{"nativePlacement":"unsupported","adapterPlacement":"unsupported","destroysNativeInput":false,"adapterPreservesCallerInput":false,"requiresPreservationCopyForRepeatedExecution":false,"preservationIncludedInPrimitiveTiming":false,"preservationIncludedInAdapterTiming":false,"nativeInputRepresentationId":"not-applicable","nativeOutputRepresentationId":"not-applicable","adapterInputRepresentationId":"","adapterOutputRepresentationId":"","physicalExtents":"","stridesElements":"","paddingElements":0,"minimumAlignmentBytes":0,"aliasing":"","reusableWorkBytes":0,"outputCanFeedOppositeDirection":false}},"setup":{"totalSeconds":0.045673249999999999,"otherSeconds":0,"allocationSeconds":0,"wisdomGenerationSeconds":0,"wisdomImportSeconds":0},"planning":{"seconds":0.045673249999999999,"configuration":"FFTW_MEASURE|FFTW_UNALIGNED|cold","temporaryBytes":0,"wisdomBytes":0,"timeLimitSeconds":0,"budgetExhausted":false},"memory":{"persistentBytes":10610744,"scratchBytes":0,"algorithmResidentBytes":10610744,"benchmarkHarnessBytes":3476544,"estimatedProcessPeakBytes":14087288,"observedProcessHighWaterBytes":31719424,"opaqueProviderMemory":true},"componentLedger":[{"stage":"setup/planning","state":"setup-only","detail":"four persistent FFTW++ applications with cold reusable FFTW plans"},{"stage":"input embedding","state":"executed","detail":"each target receives three shared advectors and three target derivatives"},{"stage":"inverse FFTs","state":"fused","detail":"four concurrent six-inverse/one-forward implicit-hybrid applications"},{"stage":"advective products","state":"fused","detail":"four concurrent negative three-term dot products"},{"stage":"forward FFTs","state":"fused","detail":"inseparable FFTW++ implicit-hybrid stage"},{"stage":"radial retention","state":"executed","detail":"each worker writes one disjoint compact target"},{"stage":"scheduler","state":"executed","detail":"persistent outer-static four-target dispatch is included"},{"stage":"oracle","state":"setup-only","detail":"independent serial explicit FFTW oracle is destroyed before candidate setup"},{"stage":"complete nonlinear WVM flux","state":"unsupported","detail":"vertical transforms, phase, and coefficient projection remain excluded"}],"timings":[{"scope":"fused-primitive","stage":"implicit hybrid transform-reduce-transform","direction":"forward","state":"fused","bytesMoved":10610744,"medianSeconds":0.00066516700000000004,"samplesSeconds":[0.00065954200000000005,0.00065616700000000003,0.00065070799999999995,0.00065037500000000002,0.00067004100000000002,0.00065891699999999997,0.00067687499999999996,0.00067379199999999999,0.00068012499999999996,0.00065254199999999999,0.00077658299999999996,0.00074108300000000002,0.00070895799999999998,0.00065908299999999998,0.000668084,0.000681209,0.00066516700000000004,0.00066120800000000004,0.00067329200000000003,0.00066062499999999997,0.00065033400000000002]},{"scope":"uninstrumented-total","stage":"WVM-like four-target horizontal advection","direction":"forward","state":"executed","bytesMoved":10610744,"medianSeconds":0.00068812500000000004,"samplesSeconds":[0.00068812500000000004,0.00066637499999999998,0.00067825000000000003,0.00075062499999999999,0.00067270800000000005,0.00065741699999999998,0.00066520800000000003,0.00065970799999999995,0.00065295800000000003,0.00068875000000000002,0.00067820800000000002,0.00092570800000000002,0.00074991700000000001,0.00074608300000000003,0.00071741700000000003,0.00069816699999999997,0.00068291700000000001,0.000767083,0.00067183300000000004,0.00069079199999999997,0.00069466600000000003]}],"correctness":[{"name":"mode-keyed retained convolution versus explicit FFTW oracle","maximumRelativeError":4.8408004589824146e-16,"relativeL2Error":5.0940841121623105e-16,"tolerance":9.9999999999999998e-13,"passed":true},{"name":"advective target 0 versus explicit oracle","maximumRelativeError":4.2442846880633863e-16,"relativeL2Error":5.1033704444467256e-16,"tolerance":9.9999999999999998e-13,"passed":true},{"name":"advective target 1 versus explicit oracle","maximumRelativeError":4.5682324055397491e-16,"relativeL2Error":5.063581811249152e-16,"tolerance":9.9999999999999998e-13,"passed":true},{"name":"advective target 2 versus explicit oracle","maximumRelativeError":5.7860508031437443e-16,"relativeL2Error":5.1133314729037727e-16,"tolerance":9.9999999999999998e-13,"passed":true},{"name":"advective target 3 versus explicit oracle","maximumRelativeError":4.3754000009913019e-16,"relativeL2Error":5.0961361433434926e-16,"tolerance":9.9999999999999998e-13,"passed":true}]}
  ]
}
