{
  "schema":"spectral-kernel-benchmark-v1",
  "status":"passed",
  "numericType":{"id":"float64","scalarBits":64},
  "run":{"id":"20260828T194651Z-issue17-ref-n1024-explicit-parallel","profile":"wvm-large-1024-nz129-f4","seed":129,"warmups":3,"samples":21},
  "provenance":{"benchmarkRepository":"JeffreyEarly/spectral-kernel-benchmarks","waveVortexModelRepository":"JeffreyEarly/wave-vortex-model","waveVortexModelIssue":129,"auditedProductionBaselineCommit":"be0f78995c49a2bfe4c43d75827856e3812ac278","historicalHarnessCommit":"b63fef8f6a9e400c6ec560205906578b763d8298","historicalDecisionCommit":"34797085d1b642b9d9c822f30a6b5c18e139c2bf"},
  "logicalOperators":{"horizontalForward":"T_h^+=P_h F_xy","horizontalInverse":"T_h^-=F_xy^-1 E_h","verticalForward":"T_z^+=V_f","verticalInverse":"T_z^-=V_i","verticalFixtureId":"orthonormal-dct2-truncated-v1","resultKey":"(k,l,j,field)"},
  "workload":{
    "Nx":1024,"Ny":1024,"Nz":1,"fields":4,
    "H":525312,"Nkl":182986,"Nj":0,"planes":4,
    "antialias":{"enabled":true,"horizontalPolicy":"radial-two-thirds","horizontalCutoffFraction":0.66666666666666663,"verticalPolicy":"floor(2*(Nz-1)/3)","verticalRetainedFraction":0},
    "grouping":{"realPlaneOrder":"x-fastest,y,z,field","fullSpectrumOrder":"z-fastest,field,kx,ky","retainedOrder":"z-fastest,field,radial-mode","verticalColumnOrder":"field-fastest-within-radial-mode","verticalMatrixFamilyId":"orthonormal-dct2-truncated-v1","verticalGroupCount":0,"verticalGroupModes":{"minimum":0,"median":0,"maximum":0},"verticalGroupColumns":{"minimum":0,"median":0,"maximum":0},"verticalGroupOrderHash":""},
    "stridesElements":{"real":{"x":1,"y":1024,"z":1048576,"field":1048576},"fullSpectrum":{"z":1,"field":1,"kx":4,"ky":2052},"retainedSpectrum":{"z":1,"field":1,"mode":4},"modalSpectrum":{"j":1,"field":0,"mode":0}},
    "bytes":{"real":125829120,"fullSpectrum":126074880,"retainedSpectrum":43916640,"modalSpectrum":0,"verticalMatrixFamilySource":0,"verticalBenchmarkEstimatedExplicitPeak":0,"orderingPackingEstimatedExplicitPeak":0,"spectralPipelineEstimatedExplicitPeak":0},
    "permutationHashes":{"retainedModeOrder":"centered-k-then-nonnegative-l-radial-disk-v1","wvmFullSpectrumOrder":""}
  },
  "environment":{"timestampUtc":"2026-08-28T19:46:51Z","hostname":"lyra","operatingSystem":"Darwin 25.6.0 arm64","machineModel":"Mac16,9","cpuBrand":"Apple M4 Max","totalCores":16,"performanceCores":12,"efficiencyCores":4,"physicalMemoryBytes":137438953472,"compiler":"AppleClang","compilerVersion":"21.0.0 (clang-2100.1.1.101)","compilerFlags":"-O3 -mcpu=native","buildType":"Release","gitCommit":"22781068236a","gitDirty":false},
  "providers":[
    {"id":"fftw-explicit-parallel-target-wvm-advection","version":"3.3.11","libraryIdentity":"FFTW 3.3.11 pthread build","algorithmId":"explicit-full-grid-shared-advectors-parallel-target-wvm-advection-15to4","nativeRepresentationId":"full-fftw-half-spectrum","modeOrderId":"centered-k-then-nonnegative-l-radial-disk-v1","schedulingId":"persistent-outer-static-4-targets-shared-advectors","providerBuild":{"sourceIdentity":"","sourceSha256":"","configureFlags":"","compilerFlags":""},"workers":4,"scheduling":{"internalWorkers":1,"outerWorkers":4,"totalLogicalWorkers":4},"gemmCallsPerExecution":0,"executionContract":{"forward":{"nativePlacement":"out-of-place","adapterPlacement":"out-of-place","destroysNativeInput":true,"adapterPreservesCallerInput":true,"requiresPreservationCopyForRepeatedExecution":true,"preservationIncludedInPrimitiveTiming":false,"preservationIncludedInAdapterTiming":true,"nativeInputRepresentationId":"full-fftw-half-spectrum","nativeOutputRepresentationId":"full-fftw-half-spectrum","adapterInputRepresentationId":"mode-keyed-radial-hermitian-wvm-advection-inputs-15","adapterOutputRepresentationId":"mode-keyed-radial-hermitian-wvm-flux-targets-4","physicalExtents":"Nx=Ny=1024; advectors=3; derivative-fields=12; flux-targets=4; topology=advectors-once-then-four-persistent-parallel-targets","stridesElements":"","paddingElements":0,"minimumAlignmentBytes":0,"aliasing":"native execution overwrites provider buffers; the timed complete adapter copies from and preserves the caller-owned compact input","reusableWorkBytes":0,"outputCanFeedOppositeDirection":false},"inverse":{"nativePlacement":"unsupported","adapterPlacement":"unsupported","destroysNativeInput":false,"adapterPreservesCallerInput":false,"requiresPreservationCopyForRepeatedExecution":false,"preservationIncludedInPrimitiveTiming":false,"preservationIncludedInAdapterTiming":false,"nativeInputRepresentationId":"not-applicable","nativeOutputRepresentationId":"not-applicable","adapterInputRepresentationId":"","adapterOutputRepresentationId":"","physicalExtents":"","stridesElements":"","paddingElements":0,"minimumAlignmentBytes":0,"aliasing":"","reusableWorkBytes":0,"outputCanFeedOppositeDirection":false}},"setup":{"totalSeconds":0.080336375000000002,"otherSeconds":0,"allocationSeconds":0,"wisdomGenerationSeconds":0,"wisdomImportSeconds":0},"planning":{"seconds":0.080336375000000002,"configuration":"FFTW_MEASURE|FFTW_UNALIGNED|cold","temporaryBytes":0,"wisdomBytes":0,"timeLimitSeconds":0,"budgetExhausted":false},"memory":{"persistentBytes":263615288,"scratchBytes":0,"algorithmResidentBytes":263615288,"benchmarkHarnessBytes":55627744,"estimatedProcessPeakBytes":319243032,"observedProcessHighWaterBytes":363741184,"opaqueProviderMemory":true},"componentLedger":[{"stage":"setup/planning","state":"setup-only","detail":"two reusable cold FFTW_MEASURE plans and a persistent four-worker pool"},{"stage":"shared advector stage","state":"executed","detail":"three compact embeddings and inverse FFTs execute once"},{"stage":"target stage","state":"executed","detail":"four derivative transform-reduce-forward-retain tasks execute concurrently"},{"stage":"scheduler","state":"executed","detail":"persistent outer-static four-target dispatch is included"},{"stage":"oracle","state":"setup-only","detail":"independent serial explicit FFTW oracle is destroyed before candidate setup"},{"stage":"complete nonlinear WVM flux","state":"unsupported","detail":"vertical transforms, phase, and coefficient projection remain excluded"}],"timings":[{"scope":"adapter-component","stage":"shared advector embedding and inverse FFTs","direction":"forward","state":"executed","bytesMoved":50380800,"medianSeconds":0.0057534580000000004,"samplesSeconds":[0.0056197909999999998,0.0053922500000000003,0.0059476249999999998,0.0054770000000000001,0.0062816670000000003,0.0061509160000000002,0.0054243750000000004,0.0056589170000000003,0.0056542909999999997,0.0056027919999999997,0.0057534580000000004,0.0059357919999999996,0.0054483329999999996,0.0055084169999999998,0.0057891660000000001,0.0058952079999999999,0.0060751670000000002,0.0057698330000000003,0.0052039579999999998,0.0058162919999999998,0.0059155409999999999]},{"scope":"adapter-component","stage":"parallel target transforms and reduction","direction":"forward","state":"executed","bytesMoved":263615288,"medianSeconds":0.010705167,"samplesSeconds":[0.010943791,0.011003333000000001,0.0098524589999999992,0.010723165999999999,0.010033083999999999,0.010353584000000001,0.010329375,0.010512917,0.010324959,0.010871333,0.01036025,0.010442208,0.010705167,0.0099487919999999997,0.01073325,0.010757249999999999,0.010852333,0.010859041,0.011264290999999999,0.010573792,0.010979792]},{"scope":"uninstrumented-total","stage":"WVM-like four-target horizontal advection","direction":"forward","state":"executed","bytesMoved":263615288,"medianSeconds":0.016654417000000001,"samplesSeconds":[0.016955333999999999,0.01733225,0.017030125,0.016577374999999998,0.016626041000000001,0.016654417000000001,0.016460540999999999,0.016554916999999999,0.016670875000000002,0.01652675,0.016663958,0.016354,0.016410833999999999,0.016208040999999999,0.016741916999999999,0.017003207999999999,0.016677250000000001,0.016310958,0.016992584000000002,0.016619083999999999,0.017275333]}],"correctness":[{"name":"mode-keyed retained convolution versus explicit FFTW oracle","maximumRelativeError":2.8757981995974681e-16,"relativeL2Error":3.057561043504166e-16,"tolerance":9.9999999999999998e-13,"passed":true},{"name":"advective target 0 versus explicit oracle","maximumRelativeError":2.6004588015844558e-16,"relativeL2Error":3.0557847624094083e-16,"tolerance":9.9999999999999998e-13,"passed":true},{"name":"advective target 1 versus explicit oracle","maximumRelativeError":2.9399966527117331e-16,"relativeL2Error":3.0620220139171055e-16,"tolerance":9.9999999999999998e-13,"passed":true},{"name":"advective target 2 versus explicit oracle","maximumRelativeError":3.4304894205242849e-16,"relativeL2Error":3.057497239466286e-16,"tolerance":9.9999999999999998e-13,"passed":true},{"name":"advective target 3 versus explicit oracle","maximumRelativeError":3.340512015162235e-16,"relativeL2Error":3.0549311715428535e-16,"tolerance":9.9999999999999998e-13,"passed":true}]}
  ]
}
